Connor Chin,5,2,1178,21,21,21,1207,1178,,100
Defeated Sarabpreet Sodhi in Round of 64 of 2023 Easter Open: +54 points for a new rating of 1054
New highest rating achieved: 1054
Defeated Kevin Aissa in Round of 32 of 2023 Easter Open: +49 points for a new rating of 1103
New highest rating achieved: 1103
Lost to Kevin Luo in Round of 16 of 2023 Easter Open: -30 points for a new rating of 1073
First ranking achieved! Rank: 43
Defeated Sahil Aggarwal in Blue Shell Ro16 of 2023 OGo-PoCo B&Y Open: +41 points for a new rating of 1114
New highest rating achieved: 1114
Defeated Brendan KC Wong in Blue Shell QF of 2023 OGo-PoCo B&Y Open: +46 points for a new rating of 1160
New highest rating achieved: 1160
Defeated Connor Louie in Blue Shell SF of 2023 OGo-PoCo B&Y Open: +47 points for a new rating of 1207
New highest rating achieved: 1207
Lost to Saurabh Pandiar in Blue Shell Final of 2023 OGo-PoCo B&Y Open: -29 points for a new rating of 1178
New highest rank achieved: 16
