Nathan Appave,2,2,1029,106,106,106,1050,1029,,100
Defeated Colin Jia in Round of 64 of 2022-2023 BC Senior Elite: +50 points for a new rating of 1050
New highest rating achieved: 1050
Lost to William Ma in Round of 32 of 2022-2023 BC Senior Elite: -53 points for a new rating of 997
First ranking achieved! Rank: 80
Defeated Paritosh Singh in State Session 1 of 2023-2024 BC Senior Elite: +50 points for a new rating of 1047
Lost to Jackson Yang in Session 2 of 2023-2024 BC Senior Elite: -18 points for a new rating of 1029
