David Yuan,3,3,1016,118,118,118,1100,1016,,100
Defeated Andrew Gu in Round 1 of 2022 C1 Thanksgiving Tournament: +50 points for a new rating of 1050
New highest rating achieved: 1050
Defeated Mitchell Purnomo in Round 2 of 2022 C1 Thanksgiving Tournament: +50 points for a new rating of 1100
New highest rating achieved: 1100
Lost to Saurabh Pandiar in Round 3 of 2022 C1 Thanksgiving Tournament: -50 points for a new rating of 1050
First ranking achieved! Rank: 27
Lost to Justin L Li in Round of 32 of 2023 New Year's Tournament: -45 points for a new rating of 1005
Defeated Christopher Lee in Round of 32 of 2023 C1 Thanksgiving Tournament: +54 points for a new rating of 1059
Lost to Nathan Lee in Round of 16 of 2023 C1 Thanksgiving Tournament: -43 points for a new rating of 1016
