Shingchun (Kevin) Wu,6,5,1109,42,42,42,1165,1109,,50
Defeated Jack Saunders in Round of 64 of 2023 Jack Underhill: +60 points for a new rating of 1060
New highest rating achieved: 1060
Lost to Nicholas Poon in Round of 32 of 2023 Jack Underhill: -56 points for a new rating of 1004
First ranking achieved! Rank: 86
Defeated Zhijing Liu in Round of 64 of 2023 Easter Open: +42 points for a new rating of 1046
Lost to Jalil Waiz in Round of 32 of 2023 Easter Open: -48 points for a new rating of 998
Defeated Haocheng Guo in Blue Shell Ro16 of 2023 OGo-PoCo B&Y Open: +40 points for a new rating of 1038
Defeated Jalil Waiz in Blue Shell QF of 2023 OGo-PoCo B&Y Open: +58 points for a new rating of 1096
New highest rating achieved: 1096
Lost to Saurabh Pandiar in Blue Shell SF of 2023 OGo-PoCo B&Y Open: -18 points for a new rating of 1078
New highest rank achieved: 45
Defeated Jason Chou in Round 1 of 2023 White Rock Tournament: +48 points for a new rating of 1126
New highest rating achieved: 1126
Defeated Nicholas Poon in Round 2 of 2023 White Rock Tournament: +39 points for a new rating of 1165
New highest rating achieved: 1165
Lost to Lyem Fedoretz in Quarterfinals of 2023 White Rock Tournament: -21 points for a new rating of 1144
New highest rank achieved: 25
Lost to Yuanjia Cai in State Session 1 of 2023-2024 BC Senior Elite: -35 points for a new rating of 1109
