Lai Yin Chung,5,3,1114,41,41,41,1169,1114,,100
Lost to Kevin Luo in Session 2 of 2022 Provincial Championships: -50 points for a new rating of 950
Defeated Kien Dinh in Round 1 of 2022 C1 Thanksgiving Tournament: +57 points for a new rating of 1007
New highest rating achieved: 1007
Defeated Min Khian Tan in Round 2 of 2022 C1 Thanksgiving Tournament: +56 points for a new rating of 1063
New highest rating achieved: 1063
Defeated Connor Louie in Round 3 of 2022 C1 Thanksgiving Tournament: +56 points for a new rating of 1119
New highest rating achieved: 1119
Lost to Saurabh Pandiar in Quarter Finals of 2022 C1 Thanksgiving Tournament: -46 points for a new rating of 1073
First ranking achieved! Rank: 18
Defeated Benoit Bordeleau in Round of 64 of 2022-2023 BC Senior Elite: +39 points for a new rating of 1112
Defeated Manmeet Singh in Round of 32 of 2022-2023 BC Senior Elite: +57 points for a new rating of 1169
New highest rating achieved: 1169
Lost to Antonio Li in Round of 16 of 2022-2023 BC Senior Elite: -55 points for a new rating of 1114
