Andrew Tan,4,2,1095,53,53,53,1145,1095,,100
Defeated Brendon Kwan in Round of 32 of 2022 Island Open: +42 points for a new rating of 1042
New highest rating achieved: 1042
Lost to Colin Wang in Round of 16 of 2022 Island Open: -47 points for a new rating of 995
First ranking achieved! Rank: 61
Defeated Justin Ho Kai Pan in Round of 32 of 2023 Kelowna Adult Open: +50 points for a new rating of 1045
New highest rating achieved: 1045
Defeated Heng Wu in Round of 16 of 2023 Kelowna Adult Open: +50 points for a new rating of 1095
New highest rating achieved: 1095
Defeated David Crawford in Quarterfinals of 2023 Kelowna Adult Open: +50 points for a new rating of 1145
New highest rating achieved: 1145
Lost to Matt Downton in Semifinals of 2023 Kelowna Adult Open: -50 points for a new rating of 1095
New highest rank achieved: 31
