Anubhav Gupta,2,2,1013,121,121,121,1060,1013,,100
Defeated Andrew Meijer in Round of 32 of 2022 Island Open: +42 points for a new rating of 1042
New highest rating achieved: 1042
Lost to Nik Cruz in Round of 16 of 2022 Island Open: -23 points for a new rating of 1019
First ranking achieved! Rank: 38
Defeated Animesh Sakorikar in Round of 32 of 2023 Kelowna Adult Open: +41 points for a new rating of 1060
New highest rating achieved: 1060
Lost to Jack Saunders in Round of 16 of 2023 Kelowna Adult Open: -47 points for a new rating of 1013
