Jalil Waiz,8,10,1033,98,98,98,1108,1033,,50
Lost to Saurabh Pandiar in Session 2 of 2022 Provincial Championships: -50 points for a new rating of 950
Lost to Victor Ho in Round of 64 of 2022-2023 BC Senior Elite: -29 points for a new rating of 921
Defeated Marcus Chan in Round of 64 of 2023 Jack Underhill: +61 points for a new rating of 982
Defeated Benson Wong in Round of 32 of 2023 Jack Underhill: +45 points for a new rating of 1027
New highest rating achieved: 1027
Lost to Lyem Fedoretz in Round of 16 of 2023 Jack Underhill: -14 points for a new rating of 1013
First ranking achieved! Rank: 80
Defeated Naishadh Parmar in Round of 64 of 2023 Easter Open: +48 points for a new rating of 1061
New highest rating achieved: 1061
Defeated Shingchun (Kevin) Wu in Round of 32 of 2023 Easter Open: +47 points for a new rating of 1108
New highest rating achieved: 1108
Lost to Joshua Liu in Round of 16 of 2023 Easter Open: -41 points for a new rating of 1067
New highest rank achieved: 48
Lost to Gurbaksh Saini in Session 1 of 2023 Provincials: -22 points for a new rating of 1045
Defeated Marco Fortin in Blue Shell Ro16 of 2023 OGo-PoCo B&Y Open: +50 points for a new rating of 1095
Lost to Shingchun (Kevin) Wu in Blue Shell QF of 2023 OGo-PoCo B&Y Open: -30 points for a new rating of 1065
Defeated Edwin Chang in Round 1 of 2023 White Rock Tournament: +20 points for a new rating of 1085
Lost to Albert Liang in Round 2 of 2023 White Rock Tournament: -25 points for a new rating of 1060
Defeated Laurence Kao in Round of 16 of 2023 POCOmon GO Open: +20 points for a new rating of 1080
Defeated Pierre Tang in Quarterfinals of 2023 POCOmon GO Open: +21 points for a new rating of 1101
Lost to Saurabh Pandiar in Semifinals of 2023 POCOmon GO Open: -9 points for a new rating of 1092
Lost to Connor Louie in Round of 64 of 2023 C1 Thanksgiving Tournament: -25 points for a new rating of 1067
Lost to Saket Thavanani in State Session 1 of 2023-2024 BC Senior Elite: -34 points for a new rating of 1033
