David Yang,5,3,1098,51,51,51,1138,1098,,100
Defeated Joseph Tan in Round of 16 of 2023 Campbell River: +57 points for a new rating of 1057
New highest rating achieved: 1057
Defeated Connor O'Reilly in Quarterfinals of 2023 Campbell River: +53 points for a new rating of 1110
New highest rating achieved: 1110
Lost to Saurabh Pandiar in Semifinals of 2023 Campbell River: -26 points for a new rating of 1084
First ranking achieved! Rank: 31
Lost to Will Bui in Round of 64 of 2023 Jack Underhill: -67 points for a new rating of 1017
Defeated David Zhai in Round of 32 of 2023 Nanaimo Open: +40 points for a new rating of 1057
Defeated Andrew Meijer in Round of 16 of 2023 Nanaimo Open: +36 points for a new rating of 1093
Defeated Sahil Aggarwal in Quarterfinal of 2023 Nanaimo Open: +45 points for a new rating of 1138
New highest rating achieved: 1138
Lost to Robert Foster in Semifinals of 2023 Nanaimo Open: -40 points for a new rating of 1098
