Chris Wiebe,3,2,1106,47,47,47,1167,1106,,100
Defeated Yancong Li in Round of 64 of 2023 New Year's Tournament: +58 points for a new rating of 1058
New highest rating achieved: 1058
Defeated David Luo in Round of 32 of 2023 New Year's Tournament: +48 points for a new rating of 1106
New highest rating achieved: 1106
Defeated Joshua R Yan in Round of 16 of 2023 New Year's Tournament: +61 points for a new rating of 1167
New highest rating achieved: 1167
Lost to Lyem Fedoretz in Quarterfinals of 2023 New Year's Tournament: -32 points for a new rating of 1135
First ranking achieved! Rank: 12
Lost to Saurabh Pandiar in Round of 64 of 2022-2023 BC Senior Elite: -29 points for a new rating of 1106
