Aayush Singh,2,2,1028,107,107,107,1058,1028,,100
Lost to Ryan Liu in Round of 64 of 2023 New Year's Tournament: -49 points for a new rating of 951
Defeated Markus Weilmeier in Round of 16 of 2023 Kelowna Open: +48 points for a new rating of 999
Defeated Sourabh Kulkarni in Quarterfinals of 2023 Kelowna Open: +59 points for a new rating of 1058
New highest rating achieved: 1058
Lost to Neil Ward in Semifinals of 2023 Kelowna Open: -30 points for a new rating of 1028
First ranking achieved! Rank: 107
