Harrison Guo,2,2,1011,126,126,126,1032,1011,,100
Lost to Shen Wei Lai in Round 1 of 2023 White Rock Tournament: -50 points for a new rating of 950
Defeated Alex Starostin in Round of 64 of 2023 C1 Thanksgiving Tournament: +57 points for a new rating of 1007
New highest rating achieved: 1007
Defeated Ev Haus in Round of 32 of 2023 C1 Thanksgiving Tournament: +25 points for a new rating of 1032
New highest rating achieved: 1032
Lost to Nicholas Chiu in Round of 16 of 2023 C1 Thanksgiving Tournament: -21 points for a new rating of 1011
First ranking achieved! Rank: 110
