Joseph Tan,2,2,1025,56,13,51,1104,1000
Defeated Yunyong Guo in Round of 16 of 2022 Victoria Closed: +100 points for a new rating of 1100
New highest rating achieved: 1100
Lost to Kwun Ho So in Quarterfinals of 2022 Victoria Closed: -76 points for a new rating of 1024
New highest rank achieved: 13
Defeated John Keith in Round of 32 of 2022 Island Open: +80 points for a new rating of 1104
New highest rating achieved: 1104
Lost to Hailegebriel Kebede in Round of 16 of 2022 Island Open: -79 points for a new rating of 1025
