Albert Liang,4,2,1179,39,15,NR,1206,1000,,100
Defeated Bruno Koloska in Round of 16 A of 2022 New Era Open: +100 points for a new rating of 1100
New highest rating achieved: 1100
Defeated YiYang Jiang in A Quarters of 2022 New Era Open: +82 points for a new rating of 1182
New highest rating achieved: 1182
Lost to Lyem Fedoretz in A Semis of 2022 New Era Open: -69 points for a new rating of 1113
First ranking achieved! Rank: NR
Defeated Sai Teja Vangari in Round 1 of 2023 White Rock Tournament: +42 points for a new rating of 1155
Defeated Jalil Waiz in Round 2 of 2023 White Rock Tournament: +51 points for a new rating of 1206
New highest rating achieved: 1206
Lost to Gurbaksh Saini in Quarterfinals of 2023 White Rock Tournament: -27 points for a new rating of 1179
