Hector Devesa,2,2,1026,137,48,NR,1175,1000,,100
Defeated Jackson Kurtz in Round of 32 of 2023 Kelowna Adult Open: +100 points for a new rating of 1100
New highest rating achieved: 1100
Defeated Hayden Ostrom in Round of 16 of 2023 Kelowna Adult Open: +75 points for a new rating of 1175
New highest rating achieved: 1175
Lost to Matt Downton in Quarterfinals of 2023 Kelowna Adult Open: -67 points for a new rating of 1108
First ranking achieved! Rank: NR
Lost to Sourabh Kulkarni in Round of 16 of 2023 Kelowna Open: -82 points for a new rating of 1026
