Mahdi Amahdi,4,2,1161,16,3,NR,1279,1000
Defeated Jithin Prakash in Round of 16 of 2022 Campbell River: +128 points for a new rating of 1128
New highest rating achieved: 1128
Defeated Kwun Ho So in Quarterfinals of 2022 Campbell River: +85 points for a new rating of 1213
New highest rating achieved: 1213
Defeated Uday Bharti in Semifinals of 2022 Campbell River: +66 points for a new rating of 1279
New highest rating achieved: 1279
Lost to Manmeet Singh in Finals of 2022 Campbell River: -63 points for a new rating of 1216
First ranking achieved! Rank: NR
Defeated Jack Chen in Session 2 of 2022 Provincial Championships: +26 points for a new rating of 1242
Lost to Joshua Liu in Quarterfinals of 2022 Provincial Championships: -81 points for a new rating of 1161
