Christopher Cui,3,2,1086,89,20,NR,1175,1000,,100
Defeated Clement Li in Round of 16 B of 2022 New Era Open: +100 points for a new rating of 1100
New highest rating achieved: 1100
Defeated Jasper Kong in B Quarters of 2022 New Era Open: +75 points for a new rating of 1175
New highest rating achieved: 1175
Lost to John Ou in B Semis of 2022 New Era Open: -96 points for a new rating of 1079
First ranking achieved! Rank: NR
Defeated Nicholas Yun in Yellow Shell Ro16 of 2023 OGo-PoCo B&Y Open: +66 points for a new rating of 1145
Lost to Ayden Travis Lee in Yellow Shell QF of 2023 OGo-PoCo B&Y Open: -59 points for a new rating of 1086
