Franklin Chen,5,6,1054,115,16,NR,1175,1000,,100
Defeated Aidan Jia Zhang in Round of 16 B of 2022 New Era Open: +100 points for a new rating of 1100
New highest rating achieved: 1100
Defeated Brian Kwok in B Quarters of 2022 New Era Open: +75 points for a new rating of 1175
New highest rating achieved: 1175
Lost to Jackie Wu in B Semis of 2022 New Era Open: -67 points for a new rating of 1108
First ranking achieved! Rank: NR
Lost to Ethan Yen in Round 1 of 2022 C1 Thanksgiving Tournament: -82 points for a new rating of 1026
Lost to David Zuo in Round of 64 of 2023 New Year's Tournament: -65 points for a new rating of 961
Lost to Ryan Liu in Round of 16 of 2023 Wing's-GHS Tournament: -49 points for a new rating of 912
Defeated John Keith in Round of 64 of 2023 Jack Underhill: +61 points for a new rating of 973
Lost to Jasper Kong in Round of 32 of 2023 Jack Underhill: -39 points for a new rating of 934
Defeated Leo Lin in Yellow Shell Ro16 of 2023 OGo-PoCo B&Y Open: +80 points for a new rating of 1014
Defeated Yu Cong Tang in Yellow Shell QF of 2023 OGo-PoCo B&Y Open: +75 points for a new rating of 1089
Lost to Jasper Kong in Yellow Shell SF of 2023 OGo-PoCo B&Y Open: -35 points for a new rating of 1054
