Lai Yin Chung,5,3,1160,45,25,NR,1214,1000,,100
Lost to Kevin Luo in Session 2 of 2022 Provincial Championships: -100 points for a new rating of 900
Defeated Kien Dinh in Round 1 of 2022 C1 Thanksgiving Tournament: +96 points for a new rating of 996
Defeated Min Khian Tan in Round 2 of 2022 C1 Thanksgiving Tournament: +85 points for a new rating of 1081
New highest rating achieved: 1081
Defeated Connor Louie in Round 3 of 2022 C1 Thanksgiving Tournament: +75 points for a new rating of 1156
New highest rating achieved: 1156
Lost to Saurabh Pandiar in Quarter Finals of 2022 C1 Thanksgiving Tournament: -50 points for a new rating of 1106
First ranking achieved! Rank: NR
Defeated Benoit Bordeleau in Round of 64 of 2022-2023 BC Senior Elite: +40 points for a new rating of 1146
Defeated Manmeet Singh in Round of 32 of 2022-2023 BC Senior Elite: +68 points for a new rating of 1214
New highest rating achieved: 1214
Lost to Antonio Li in Round of 16 of 2022-2023 BC Senior Elite: -54 points for a new rating of 1160
New highest rank achieved: 25
