Anubhav Gupta,2,2,1033,131,50,NR,1091,1000,,100
Defeated Andrew Meijer in Round of 32 of 2022 Island Open: +71 points for a new rating of 1071
New highest rating achieved: 1071
Lost to Nik Cruz in Round of 16 of 2022 Island Open: -27 points for a new rating of 1044
First ranking achieved! Rank: NR
Defeated Animesh Sakorikar in Round of 32 of 2023 Kelowna Adult Open: +47 points for a new rating of 1091
New highest rating achieved: 1091
Lost to Jack Saunders in Round of 16 of 2023 Kelowna Adult Open: -58 points for a new rating of 1033
