Joshua R Yan,3,1,1206,11,2,NR,1262,1000
Defeated Kevin Huang in Quarterfinals of 2022 Victoria Closed: +128 points for a new rating of 1128
New highest rating achieved: 1128
Defeated Colt Love in Semifinals of 2022 Victoria Closed: +64 points for a new rating of 1192
New highest rating achieved: 1192
Defeated Kwun Ho So in Finals of 2022 Victoria Closed: +70 points for a new rating of 1262
New highest rating achieved: 1262
First ranking achieved! Rank: NR
Lost to Lyem Fedoretz in Round 1 of 2022 C1 Thanksgiving Tournament: -56 points for a new rating of 1206
