Harrison Guo,2,2,1011,158,149,NR,1027,1000,,100
Lost to Shen Wei Lai in Round 1 of 2023 White Rock Tournament: -100 points for a new rating of 900
Defeated Alex Starostin in Round of 64 of 2023 C1 Thanksgiving Tournament: +96 points for a new rating of 996
Defeated Ev Haus in Round of 32 of 2023 C1 Thanksgiving Tournament: +31 points for a new rating of 1027
New highest rating achieved: 1027
Lost to Nicholas Chiu in Round of 16 of 2023 C1 Thanksgiving Tournament: -16 points for a new rating of 1011
First ranking achieved! Rank: NR
