Connor Louie,9,6,1131,10,10,10,1149,1131,,50
Defeated Kevin Phuc in Round of 16 of 2022 Campbell River: +57 points for a new rating of 1057
New highest rating achieved: 1057
Lost to Uday Bharti in Quarterfinals of 2022 Campbell River: -45 points for a new rating of 1012
First ranking achieved! Rank: 8
Defeated Nelson Oi Sang Chan in Session 2 of 2022 Provincial Championships: +48 points for a new rating of 1060
New highest rating achieved: 1060
Defeated Manmeet Singh in Quarterfinals of 2022 Provincial Championships: +75 points for a new rating of 1135
New highest rating achieved: 1135
Lost to Jackson Yang in Semifinals of 2022 Provincial Championships: -56 points for a new rating of 1079
Lost to Kevin Luo in Play-off 3/4 of 2022 Provincial Championships: -54 points for a new rating of 1025
Defeated Dong Ly in Round of 16 A of 2022 New Era Open: +46 points for a new rating of 1071
Lost to Jack Chen in A Quarters of 2022 New Era Open: -58 points for a new rating of 1013
Defeated Mitash Jain in Round 1 of 2022 C1 Thanksgiving Tournament: +48 points for a new rating of 1061
Defeated Jashan Deep Singh in Round 2 of 2022 C1 Thanksgiving Tournament: +48 points for a new rating of 1109
Lost to Lai Yin Chung in Round 3 of 2022 C1 Thanksgiving Tournament: -29 points for a new rating of 1080
Defeated Chris Yu in Round of 32 of 2022 Island Open: +22 points for a new rating of 1102
Defeated Hardeep Singh in Round of 16 of 2022 Island Open: +21 points for a new rating of 1123
Defeated Kwun Ho So in Quarterfinals of 2022 Island Open: +26 points for a new rating of 1149
New highest rating achieved: 1149
Lost to Saurabh Pandiar in Semifinals of 2022 Island Open: -18 points for a new rating of 1131
