Kwun Ho So,7,4,1122,12,12,12,1149,1122,,50
Defeated Colt Love in Round of 32 of 2022 Campbell River: +50 points for a new rating of 1050
New highest rating achieved: 1050
Defeated Kelsey Liang in Round of 16 of 2022 Campbell River: +50 points for a new rating of 1100
New highest rating achieved: 1100
Lost to Mahdi Amahdi in Quarterfinals of 2022 Campbell River: -57 points for a new rating of 1043
First ranking achieved! Rank: 5
Defeated Joseph Tan in Quarterfinals of 2022 Victoria Closed: +51 points for a new rating of 1094
Defeated Colin Wang in Semifinals of 2022 Victoria Closed: +44 points for a new rating of 1138
New highest rating achieved: 1138
Lost to Joshua R Yan in Finals of 2022 Victoria Closed: -55 points for a new rating of 1083
Defeated Animesh Sakorikar in Round 1 of 2022 C1 Thanksgiving Tournament: +38 points for a new rating of 1121
Lost to David Purnomo in Round 2 of 2022 C1 Thanksgiving Tournament: -61 points for a new rating of 1060
Defeated Jack Saunders in Round of 32 of 2022 Island Open: +47 points for a new rating of 1107
Defeated Will Bui in Round of 16 of 2022 Island Open: +42 points for a new rating of 1149
New highest rating achieved: 1149
Lost to Connor Louie in Quarterfinals of 2022 Island Open: -27 points for a new rating of 1122
